{
  "id": "amazon-20917568511",
  "source": "amazon",
  "case_number": "20917568511",
  "title": "1 ASIN flagged high return rate (Concessions Hub review)",
  "description": null,
  "status": "open",
  "tags": [
    "returns",
    "listing"
  ],
  "brand": null,
  "linked_ds": [],
  "email_link": null,
  "email_id": null,
  "opened": "2026-06-24",
  "updated": "2026-06-24",
  "owner": null,
  "notes": null,
  "_meta": {}
}
